{
  "schemaVersion": 1,
  "preset": "vue-ts",
  "title": "vue-ts",
  "sources": {
    "/src/App.vue": "files/src/App.vue",
    "/src/message.js": "files/src/message.js"
  },
  "verification": {
    "steps": [
      {
        "action": "preview",
        "text": "Count: 0"
      },
      {
        "action": "click",
        "role": "button",
        "name": "Count: 0"
      },
      {
        "action": "preview",
        "text": "Count: 1"
      }
    ]
  },
  "dependencies": {
    "lodash-es": "4.17.21"
  }
}
