{
  "schemaVersion": 1,
  "preset": "react-ts",
  "sources": {
    "/App.tsx": "files/App.tsx",
    "/prefix.ts": "files/prefix.ts"
  },
  "dependencies": {
    "lodash-es": "4.17.21"
  },
  "solutionSources": {
    "/App.tsx": "solution/App.tsx"
  },
  "checks": {
    "kind": "browser-jest",
    "sources": {
      "/checks/greeting.test.tsx": "checks/greeting.test.tsx"
    }
  },
  "verification": {
    "starterChecks": "fail",
    "rejectedSources": {
      "/App.tsx": "rejected/App.tsx"
    }
  }
}
